{"schema":"chancadem.hp500.crusherbayes/v1","source":{"paper":"Rocha, Campos, Silva & Tavares 2024","doi":"10.3390/min14090919","license":"CC BY 4.0","table":"A1 (measured) + 5 (fit)"},"engine_version":"0.11.000","n":10,"seed":42,"inputs_sha256":"483d24c5ddd35b41f2be05628fe9f09fd22562c5ab59cda69e036b9bb0ce605a","method":{"sampler":"emcee","sampler_version":"3.1.6","move":"StretchMove (affine-invariant ensemble sampler, Goodman and Weare 2010, https://doi.org/10.2140/camcos.2010.5.65)","walkers":20,"steps":7000,"burn_in_steps":1000,"thin":10,"predictive_draws_per_sample":20,"likelihood":"Gaussian on the measured throughput [t/h] and power [kW]: engine(theta) + discrepancy + noise, the discrepancy (a constant and slopes on standardized CSS and f80, N(0, tau^2) each) integrated out exactly","discrepancy_prior_sd":{"tph":140.0,"kW":36.0},"noise_prior":{"family":"ln sigma ~ N(ln median, 1)","median":{"tph":60.0,"kW":15.0},"log_sd":1.0},"p80":"not a target: it is not measured","interval_80":"the 10th and 90th percentiles of the posterior predictive draws of the held-out survey"},"priors":[{"name":"q_ref_tph","unit":"t/h","nominal":647.0,"log":true,"mu":6.472346294500901,"sd":0.25,"lo":5.703782474656201,"hi":7.24422751560335,"source":"nominal: Rocha et al. 2024, https://doi.org/10.3390/min14090919, Table 4 (QT about 647 t/h); width: weakly informative, a log standard deviation of 0.25 (plus or minus 28 percent); the surveys span 813 to 1639 t/h"},{"name":"wi_kwh_t","unit":"kWh/t","nominal":9.0,"log":true,"mu":2.1972245773362196,"sd":0.17,"lo":1.6094379124341003,"hi":2.6390573296152584,"source":"nominal: the blend Wi of the engine; the compact and supercompact itabirite bands are 7.2 and 10.6 kWh/t (Rocha et al. 2024, https://doi.org/10.3390/min14090919, Table 1, as HP500_ORE); width: weakly informative, a log standard deviation of 0.17 (plus or minus 18 percent, 7.6 to 10.7 kWh/t)"},{"name":"zeta","unit":"-","nominal":1.3,"log":true,"mu":0.26236426446749106,"sd":0.23,"lo":-0.6931471805599453,"hi":0.9162907318741551,"source":"nominal: the slope of Pc = zeta Pd + Pn, Rocha et al. 2024, https://doi.org/10.3390/min14090919, Table 5; width: weakly informative, a log standard deviation of 0.23 (plus or minus 26 percent)"},{"name":"pn_kw","unit":"kW","nominal":110.0,"log":false,"mu":110.0,"sd":50.0,"lo":0.0,"hi":300.0,"source":"nominal: the no-load power of Pc = zeta Pd + Pn, Rocha et al. 2024, https://doi.org/10.3390/min14090919, Table 5; width: weakly informative, standard deviation 50 kW; the measured power spans 187 to 355 kW"},{"name":"k1_scale","unit":"-","nominal":1.0,"log":true,"mu":0.0,"sd":0.15,"lo":-0.6931471805599453,"hi":0.6931471805599453,"source":"multiplier of K1 = 0.23 CSS + 0.30 f80 (Rocha et al. 2024, https://doi.org/10.3390/min14090919, Table 5); width: a log standard deviation of 0.15 (plus or minus 16 percent)"},{"name":"k2_scale","unit":"-","nominal":1.0,"log":true,"mu":0.0,"sd":0.15,"lo":-0.6931471805599453,"hi":0.6931471805599453,"source":"multiplier of K2 = 12.0 + 0.55 CSS + 0.40 f80 (Rocha et al. 2024, https://doi.org/10.3390/min14090919, Table 5); width: a log standard deviation of 0.15"},{"name":"k3","unit":"-","nominal":2.3,"log":false,"mu":2.3,"sd":0.5,"lo":1.0,"hi":4.0,"source":"nominal: Rocha et al. 2024, https://doi.org/10.3390/min14090919, Table 5; the typical K3 of the cone models of the engine runs 2.0 to 2.7 (Napier-Munn et al. 1996, Mineral Comminution Circuits, JKMRC); width: standard deviation 0.5"},{"name":"t10_shift_pct","unit":"t10 percentage points","nominal":0.0,"log":false,"mu":0.0,"sd":4.0,"lo":-15.0,"hi":15.0,"source":"shift of the constant 64 of t10 (%) = 64 - 0.12 CSS - 0.23 f80 (Rocha et al. 2024, https://doi.org/10.3390/min14090919, Table 5); width: standard deviation 4 points of t10 (the engine caps t10 at 44 percent)"}],"convergence":{"criterion":"converged when the post-burn chain is at least 50 integrated autocorrelation times long (emcee get_autocorr_time, largest over the parameters); a failing posterior is recorded as not converged","tau_factor":50,"folds":[{"fold":1,"converged":false,"tau_max":130.3,"post_burn_steps":6000,"chain_over_tau":46.1,"acceptance_fraction":0.412,"samples":12000},{"fold":2,"converged":false,"tau_max":133.8,"post_burn_steps":6000,"chain_over_tau":44.8,"acceptance_fraction":0.412,"samples":12000},{"fold":3,"converged":false,"tau_max":142.8,"post_burn_steps":6000,"chain_over_tau":42.0,"acceptance_fraction":0.412,"samples":12000},{"fold":4,"converged":false,"tau_max":200.5,"post_burn_steps":6000,"chain_over_tau":29.9,"acceptance_fraction":0.385,"samples":12000},{"fold":5,"converged":false,"tau_max":130.1,"post_burn_steps":6000,"chain_over_tau":46.1,"acceptance_fraction":0.41,"samples":12000},{"fold":6,"converged":false,"tau_max":135.7,"post_burn_steps":6000,"chain_over_tau":44.2,"acceptance_fraction":0.411,"samples":12000},{"fold":7,"converged":false,"tau_max":144.8,"post_burn_steps":6000,"chain_over_tau":41.4,"acceptance_fraction":0.408,"samples":12000},{"fold":8,"converged":false,"tau_max":148.3,"post_burn_steps":6000,"chain_over_tau":40.5,"acceptance_fraction":0.412,"samples":12000},{"fold":9,"converged":false,"tau_max":131.3,"post_burn_steps":6000,"chain_over_tau":45.7,"acceptance_fraction":0.411,"samples":12000},{"fold":10,"converged":false,"tau_max":126.4,"post_burn_steps":6000,"chain_over_tau":47.5,"acceptance_fraction":0.408,"samples":12000},{"fold":"all","converged":false,"tau_max":142.7,"post_burn_steps":6000,"chain_over_tau":42.1,"acceptance_fraction":0.41,"samples":12000}],"all_converged":false},"loo":{"tph":{"measured":[1639.0,1267.0,1240.0,1034.0,1124.0,813.0,1050.0,1138.0,820.0,1334.0],"pred_mean":[1306.02,1407.51,1006.01,1195.5,1122.44,918.26,845.69,1112.4,920.75,1427.37],"lo80":[1139.92,1190.42,797.26,1003.52,904.65,689.45,563.62,879.53,693.4,1198.0],"hi80":[1469.71,1620.34,1217.88,1385.29,1341.35,1149.93,1128.59,1341.26,1151.26,1652.99],"scores":{"mape_pct":12.0,"rmse":168.46,"lpd_mean":-6.678,"coverage_80":0.8,"mean_width":439.88}},"kW":{"measured":[209.0,212.0,262.0,349.0,325.0,355.0,306.0,325.0,350.0,187.0],"pred_mean":[242.14,242.01,296.92,271.19,283.35,350.74,373.06,287.52,351.6,241.94],"lo80":[183.05,183.87,234.29,233.08,227.84,286.31,302.62,228.07,288.69,184.36],"hi80":[303.09,301.61,358.38,310.39,338.79,413.36,442.31,347.7,413.13,301.72],"scores":{"mape_pct":14.29,"rmse":44.66,"lpd_mean":-5.34,"coverage_80":0.9,"mean_width":117.83}}},"comparators":{"tph":{"M0":{"mape_pct":12.09,"rmse":176.67,"lpd_mean":-6.896,"coverage_80":0.8,"mean_width":473.76},"B_lin":{"mape_pct":13.67,"rmse":177.75,"lpd_mean":-6.709,"coverage_80":0.8,"mean_width":478.76},"M2":{"mape_pct":12.18,"rmse":174.42,"lpd_mean":-6.647,"coverage_80":0.8,"mean_width":468.51}},"kW":{"M0":{"mape_pct":25.94,"rmse":78.52,"lpd_mean":-5.847,"coverage_80":0.9,"mean_width":209.79},"B_lin":{"mape_pct":12.78,"rmse":44.56,"lpd_mean":-5.341,"coverage_80":0.8,"mean_width":119.6},"M2":{"mape_pct":14.03,"rmse":48.68,"lpd_mean":-5.399,"coverage_80":0.8,"mean_width":129.82}}},"comparators_note":"scored on the same ten surveys: B_lin, M0 (the CrusherCal band) and M2 with the nested 80 percent band of loo.nested_band_coverage (sigma of each survey from the other nine held-out residuals)","contraction":[{"name":"q_ref_tph","unit":"t/h","nominal":647.0,"prior_sd":167.0101,"posterior_mean":645.9799,"posterior_sd":72.8446,"contraction":0.436},{"name":"wi_kwh_t","unit":"kWh/t","nominal":9.0,"prior_sd":1.5156,"posterior_mean":8.4062,"posterior_sd":1.2656,"contraction":0.835},{"name":"zeta","unit":"-","nominal":1.3,"prior_sd":0.3046,"posterior_mean":1.1439,"posterior_sd":0.2176,"contraction":0.715},{"name":"pn_kw","unit":"kW","nominal":110.0,"prior_sd":47.8527,"posterior_mean":84.3612,"posterior_sd":40.3199,"contraction":0.843},{"name":"k1_scale","unit":"-","nominal":1.0,"prior_sd":0.1524,"posterior_mean":1.0652,"posterior_sd":0.1516,"contraction":0.995},{"name":"k2_scale","unit":"-","nominal":1.0,"prior_sd":0.1524,"posterior_mean":1.0534,"posterior_sd":0.1578,"contraction":1.036},{"name":"k3","unit":"-","nominal":2.3,"prior_sd":0.4893,"posterior_mean":2.2324,"posterior_sd":0.4903,"contraction":1.002},{"name":"t10_shift_pct","unit":"t10 percentage points","nominal":0.0,"prior_sd":3.9907,"posterior_mean":-0.2383,"posterior_sd":3.8968,"contraction":0.976},{"name":"sigma_tph","unit":"t/h","nominal":60.0,"prior_sd":129.6718,"posterior_mean":147.4483,"posterior_sd":41.0662,"contraction":0.317},{"name":"sigma_kW","unit":"kW","nominal":15.0,"prior_sd":32.418,"posterior_mean":39.2233,"posterior_sd":11.1068,"contraction":0.343},{"name":"discrepancy_tph_constant","unit":"t/h","nominal":0.0,"prior_sd":140.0,"posterior_mean":53.9173,"posterior_sd":118.6241,"contraction":0.847},{"name":"discrepancy_tph_css","unit":"t/h","nominal":0.0,"prior_sd":140.0,"posterior_mean":98.9973,"posterior_sd":49.7683,"contraction":0.355},{"name":"discrepancy_tph_f80","unit":"t/h","nominal":0.0,"prior_sd":140.0,"posterior_mean":55.3914,"posterior_sd":48.4317,"contraction":0.346},{"name":"discrepancy_kW_constant","unit":"kW","nominal":0.0,"prior_sd":36.0,"posterior_mean":-12.0988,"posterior_sd":32.7689,"contraction":0.91},{"name":"discrepancy_kW_css","unit":"kW","nominal":0.0,"prior_sd":36.0,"posterior_mean":-57.0572,"posterior_sd":13.8753,"contraction":0.385},{"name":"discrepancy_kW_f80","unit":"kW","nominal":0.0,"prior_sd":36.0,"posterior_mean":-4.8595,"posterior_sd":13.0859,"contraction":0.363}],"contraction_note":"posterior over prior standard deviation on the fit to all ten surveys; below 0.5 the surveys identify the parameter, near 1 it stays at its prior; the discrepancy rows are the exact conditional of the coefficients given the engine scalars","kill_criterion":{"rule":"dropped as a predictor if (a) power LOO MAPE is not below B-lin's by at least 3 points and the throughput LOO MAPE does not beat the backbone M0's by at least 3 points, and (b) on either target the coverage lies outside 0.7 to 0.9 or the mean